{
    "id": "9d2c4e6f-1a3b-4c5d-8e7f-0a1b2c3d4e5f",
    "item_id": "canonical@1",
    "item_type": "canonical",
    "reason": "DESIGN_LOCK",
    "priority": "none",
    "decision": "approve",
    "decided_by": "user:42",
    "decided_at": "2026-10-19T16:39:12Z",
    "note": "Hull door position and deck count match the model sheet."
}
